{
  "protocol": "relay.launch-receipt/v2",
  "receipt_id": "rcpt~1c7712f7cb17",
  "request_id": "cli-512a615a-0a4e-43d0-ba42-d9b4a477b933",
  "client_id": "cli-e8e91c8a-32c5-498b-92c6-d999c7089a3e",
  "method": "start",
  "state": "committed",
  "reason": null,
  "run_id": "R001-relay-dhr72-real-checkpoint-1-20260904",
  "node_id": null,
  "attempt_id": null,
  "kind": "start",
  "issued_at": "2026-09-04T08:52:47.91Z",
  "issued_by_runtime": "runtime-8a73b5ad-0cbd-45ea-aeab-4e5755e62870",
  "request_digest": "0aa774b04b7c2516b670b5b1122b3ee4b6537c7cc29ab998cbcfd5643de4d1c1"
}