[
  {
    "protocol": "relay.launch-receipt/v2", "receipt_id": "rcpt-1", "request_id": "req-1", "client_id": "generic-1", "method": "control", "state": "committed", "reason": null, "run_id": "RUN-1", "node_id": null, "attempt_id": null, "kind": "resume", "issued_at": "2026-08-21T10:00:00+08:00", "issued_by_runtime": "runtime-a#lease-1", "request_digest": "bbbbbbbbbbbbbbbbbbbbbbbbbbbbbbbbbbbbbbbbbbbbbbbbbbbbbbbbbbbbbbbb"
  },
  {
    "protocol": "relay.launch-receipt/v2", "receipt_id": "rcpt-2", "request_id": "req-2", "client_id": "generic-1", "method": "control", "state": "failed", "reason": "E_LEGACY_READ_ONLY", "run_id": "RUN-0", "node_id": null, "attempt_id": null, "kind": "stop", "issued_at": "2026-08-21T10:00:00+08:00", "issued_by_runtime": "runtime-a#lease-1", "request_digest": "cccccccccccccccccccccccccccccccccccccccccccccccccccccccccccccccc"
  }
]
