{
  "protocol": "relay.launch-receipt/v2",
  "receipt_id": "rcpt~5a0fbae1b5a9",
  "request_id": "cli-2285abdf-d2fa-4902-a77a-8b0035c65d8b",
  "client_id": "cli-535c655a-1ac1-4c79-8617-e2dff1019037",
  "method": "start",
  "state": "committed",
  "reason": null,
  "run_id": "R001-relay-dhr72-real-checkpoint-1-20260905",
  "node_id": null,
  "attempt_id": null,
  "kind": "start",
  "issued_at": "2026-09-05T07:18:12.589Z",
  "issued_by_runtime": "runtime-126bfa50-dbeb-42e0-b401-da26ee7ae7a2",
  "request_digest": "2f7e459a55e55886a2d59e7e734ed2d030736f164cf8bc663d913f0460fa4e9c"
}