{
  "protocol": "relay.launch-receipt/v2",
  "receipt_id": "att~743638c532c4",
  "request_id": "cli-21c5d2fa-63b8-4e82-88f9-ff7cac51e910",
  "client_id": "cli-54c3b3da-98ff-494f-8613-5971edf27f82",
  "method": "start",
  "state": "committed",
  "reason": null,
  "run_id": "R001-relay-dhr72-real-checkpoint-1-20260905",
  "node_id": null,
  "attempt_id": null,
  "kind": "start",
  "issued_at": "2026-09-04T18:08:46.756Z",
  "issued_by_runtime": "runtime-cb13dfe4-a07c-4c1b-8d11-0c1abe9bf8c2",
  "request_digest": "64b6bb6a0c57e00575b401e2233e190fdf02c6d2f1959abc799991bab62fe38e"
}