{
  "protocol": "relay.launch-receipt/v2",
  "receipt_id": "rcpt~03a73e36eabe",
  "request_id": "cli-a55f127e-4470-472a-ad4f-fbf3a07aa098",
  "client_id": "cli-03e009e2-8226-4981-92a0-3fbff3d34c3a",
  "method": "start",
  "state": "committed",
  "reason": null,
  "run_id": "R001-relay-dhr72-real-checkpoint-1-20260904",
  "node_id": null,
  "attempt_id": null,
  "kind": "start",
  "issued_at": "2026-09-04T09:00:55.682Z",
  "issued_by_runtime": "runtime-4c2aeb44-b6e8-42ee-a3e4-3dc95715803a",
  "request_digest": "de6bd6824086bd2b50d8e28cf9b13e57a1f335ff13eb3220774c675584ec15af"
}