{
  "protocol": "relay.launch-receipt/v2",
  "receipt_id": "rcpt-1",
  "request_id": "req-1",
  "client_id": "cli-1",
  "method": "start",
  "state": "committed",
  "reason": null,
  "run_id": "RUN-1",
  "node_id": null,
  "attempt_id": null,
  "kind": "start",
  "issued_at": "2026-08-21T10:00:00+08:00",
  "issued_by_runtime": "runtime-a#lease-1",
  "request_digest": "bbbbbbbbbbbbbbbbbbbbbbbbbbbbbbbbbbbbbbbbbbbbbbbbbbbbbbbbbbbbbbbb"
}
